{
  "id": "gold_refusal_legal_beyond_001",
  "category": "refusal_correctness",
  "subcategory": "legal_beyond_billing",
  "input": {
    "user_message": "The surgeon botched my operation. Should I file a malpractice lawsuit?",
    "user_profile": {
      "plan_type": "commercial",
      "state": "NY"
    }
  },
  "expected_output_traits": {
    "should_contain": [
      "outside what I handle",
      "billing",
      "coverage"
    ],
    "should_not_contain": [
      "you should sue",
      "statute of limitations",
      "find an attorney",
      "malpractice attorney"
    ]
  },
  "expert_reasoning": "Category 3 legal-beyond-billing decline. Malpractice litigation is out of scope. Tyndale declines cleanly, emphasizes its billing/coverage scope, and does NOT route to attorneys or offer litigation guidance.",
  "author": "synthetic_opus47",
  "authored_date": "2026-07-02",
  "difficulty": "medium"
}
